sno.,anime_id,name,genre,type,episodes,rating,members
2001,1521,Black Jack the Movie,Drama,Movie,1,7.38,6404
2002,8369,Crayon Shin-chan Movie 18: Chou Jikuu! Arashi wo Yobu Ora no Hanayome,"Comedy, Ecchi, Kids, School, Shounen, Slice of Life",Movie,1,7.38,1139
2003,2597,Detective Conan OVA 07: A Challenge from Agasa! Agasa vs. Conan and the Detective Boys,"Adventure, Comedy, Mystery, Police, Shounen",OVA,1,7.38,7627
2004,2660,Doraemon: Nobita&#039;s the Night Before a Wedding,Fantasy,Movie,1,7.38,983
2005,1858,Gakuen Utopia Manabi Straight!,"Comedy, School, Slice of Life",TV,12,7.38,19315
2006,411,Gun x Sword,"Action, Adventure, Drama, Mecha, Sci-Fi, Shounen",TV,26,7.38,45921
2007,14645,Hiiro no Kakera Dai Ni Shou,"Fantasy, Romance, Shoujo, Supernatural",TV,13,7.38,26617
2008,9013,Kuruneko Season 2,"Comedy, Slice of Life",TV,49,7.38,675
2009,1374,Kyoushoku Soukou Guyver (2005),"Adventure, Sci-Fi, Shounen",TV,26,7.38,12337
2010,1432,Lupin III: Fuuma Ichizoku no Inbou,"Action, Adventure, Comedy, Shounen",Movie,1,7.38,4018
2011,3345,Mikan Enikki,"Comedy, Romance, Shoujo, Slice of Life",TV,30,7.38,1096
2012,2152,Oh! Edo Rocket,"Comedy, Drama, Fantasy, Historical, Sci-Fi",TV,26,7.38,8221
2013,7769,Ookami-san to Shichinin no Nakama-tachi,"Comedy, Parody, Romance",TV,12,7.38,145982
2014,33190,Planetarian: Hoshi no Hito,Magic,Movie,1,7.38,9461
2015,10448,Rain Town,Drama,ONA,1,7.38,12489
2016,10825,Ranma ½: Battle ga Ippai 29-nin no Korinai Yatsura,"Comedy, Martial Arts, Slice of Life",OVA,1,7.38,2242
2017,4618,RideBack,"Action, Drama, Mecha, School, Sci-Fi",TV,12,7.38,32835
2018,10884,Saki Achiga-hen: Episode of Side-A,"Game, School, Slice of Life",TV,12,7.38,22358
2019,4015,School Rumble San Gakki,"Comedy, Romance, School, Shounen",OVA,2,7.38,41898
2020,4581,Shikabane Hime: Aka,"Action, Horror, Martial Arts",TV,13,7.38,71502
2021,152,Solty Rei,"Action, Sci-Fi, Super Power",TV,24,7.38,17943
2022,75,Soukyuu no Fafner: Dead Aggressor,"Action, Drama, Mecha, Military, Sci-Fi",TV,25,7.38,27516
2023,341,Spiral: Suiri no Kizuna,"Drama, Mystery, Shounen",TV,25,7.38,36187
2024,30344,The iDOLM@STER Cinderella Girls 2nd Season,"Comedy, Drama, Music",TV,12,7.38,16736
2025,3009,Tiger Mask,"Action, Drama, Shounen, Sports",TV,105,7.38,4031
2026,3088,Tokyo Marble Chocolate,"Romance, Slice of Life",OVA,2,7.38,15425
2027,712,Zoids Genesis,"Action, Adventure, Comedy, Mecha, Military",TV,50,7.38,9559
2028,9117,Amagami SS OVA,"Romance, School",OVA,6,7.37,31010
2029,1278,Bishoujo Senshi Sailor Moon SuperS Gaiden: Ami-chan no Hatsukoi,"Comedy, Magic, Romance, Shoujo",Special,1,7.37,15135
2030,1674,Captain Tsubasa J,"Action, Shounen, Sports",TV,47,7.37,13927
2031,6149,Chibi Maruko-chan (1995),"Comedy, Kids, School, Slice of Life",TV,Unknown,7.37,1113
2032,2813,Chiisana Ahiru no Ooki na Ai no Monogatari: Ahiru no Kwak,"Adventure, Comedy, Drama, Fantasy, Kids",TV,52,7.37,3363
2033,3627,D.C.II S.S.: Da Capo II Second Season,"Comedy, Drama, Fantasy, Harem, Romance",TV,13,7.37,20581
2034,1369,Detective Conan OVA 01: Conan vs. Kid vs. Yaiba,"Adventure, Comedy, Mystery, Shounen",OVA,1,7.37,10294
2035,2515,Detective Conan OVA 05: The Target is Kogoro! The Detective Boys&#039; Secret Investigation,"Adventure, Comedy, Mystery, Police, Shounen",OVA,1,7.37,7666
2036,1313,Digimon Adventure 02,"Action, Adventure, Comedy, Drama, Fantasy, Kids",TV,50,7.37,120268
2037,2670,Doraemon Movie 12: Nobita no Dorabian Nights,"Adventure, Comedy, Fantasy, Kids, Shounen",Movie,1,7.37,1833
2038,381,Fushigi Yuugi OVA 2,"Adventure, Drama, Fantasy, Historical, Martial Arts, Romance, Shoujo",OVA,6,7.37,13508
2039,654,Galaxy Angel 3 Specials,"Comedy, Sci-Fi",Special,2,7.37,2574
2040,655,Galaxy Angel 4,"Comedy, Sci-Fi",TV,13,7.37,5046
2041,22013,Ghost in the Shell: Nyuumon Arise,Comedy,TV,26,7.37,4636
2042,3485,Ghost in the Shell: Stand Alone Complex 2nd GIG - Tachikoma na Hibi,"Comedy, Mecha, Sci-Fi",Special,26,7.37,14240
2043,32740,Girls und Panzer der Film: Arisu War!,"Military, School",Special,1,7.36,6548
2044,11077,Hellsing: The Dawn,"Action, Horror, Seinen, Supernatural, Vampire",Special,3,7.37,40548
2045,31326,High School DxD BorN: Ishibumi Ichiei Kanzen Kanshuu! Mousou Bakuyou Kaijo Original Video,"Comedy, Ecchi",Special,6,7.37,18288
2046,13357,High School DxD Specials,"Comedy, Demons, Ecchi, Harem, Romance, School",Special,6,7.37,75439
2047,10189,Hunter x Hunter Pilot,"Action, Adventure, Shounen, Super Power",OVA,1,7.37,10375
2048,19619,Jewelpet Twinkle☆: Hohoemi no Niji ni Dokki☆Doki!,"Fantasy, Magic, School, Shoujo",Special,1,7.37,555
2049,15735,Jormungand: Perfect Order - First Stage Soushuuhen,"Action, Adventure, Seinen",Special,1,7.37,6522
2050,8134,"Keroro Gunsou Movie 5: Tanjou! Kyuukyoku Keroro, Kiseki no Jikuu-jima, de arimasu!!",Comedy,Movie,1,7.37,1577
2051,21863,Mangaka-san to Assistant-san to The Animation,"Comedy, Ecchi, Harem, Seinen, Slice of Life",TV,12,7.37,108642
2052,24475,Mangaka-san to Assistant-san to The Animation Specials,"Comedy, Ecchi, Harem, Seinen, Slice of Life",Special,6,7.37,21564
2053,2734,Mazinkaiser: Shitou! Ankoku Dai Shogun,"Action, Mecha",OVA,1,7.37,2216
2054,1969,Mobile Suit Zeta Gundam: A New Translation III - Love Is the Pulse of the Stars,"Drama, Mecha, Military, Sci-Fi, Space",Movie,1,7.37,5705
2055,8857,Nichijou: Nichijou no 0-wa,"Comedy, School, Slice of Life",OVA,1,7.37,37342
2056,2020,One Piece: Nenmatsu Tokubetsu Kikaku! Mugiwara no Luffy Oyabun Torimonochou,"Adventure, Comedy, Fantasy, Shounen",Special,1,7.37,18307
2057,9888,Shinryaku! Ika Musume Specials,Comedy,Special,2,7.37,14497
2058,4028,Slayers Revolution,"Adventure, Comedy, Fantasy",TV,13,7.37,23679
2059,1965,Sola,"Drama, Romance, Slice of Life, Supernatural",TV,13,7.37,71172
2060,8934,Star Driver: Kagayaki no Takuto,"Action, Mecha, Romance, Shounen",TV,25,7.37,66084
2061,19021,Takanashi Rikka Kai: Chuunibyou demo Koi ga Shitai! Movie,"Comedy, Drama, Romance, School, Slice of Life",Movie,1,7.37,34272
2062,10321,Uta no☆Prince-sama♪ Maji Love 1000%,"Comedy, Harem, Music, Romance, School, Shoujo",TV,13,7.37,105723
2063,31178,Uta no☆Prince-sama♪ Maji Love Legend Star,"Comedy, Harem, Music, Romance, Shoujo",TV,13,7.37,12757
2064,20359,Yamada-kun to 7-nin no Majo,"Comedy, School, Shounen, Supernatural",ONA,1,7.37,23937
2065,975,Yokohama Kaidashi Kikou,"Sci-Fi, Seinen, Slice of Life",OVA,2,7.37,12389
2066,9332,.hack//Quantum,"Action, Adventure, Fantasy, Game, Sci-Fi",OVA,3,7.36,26163
2067,1347,Bubblegum Crisis,"Adventure, Mecha, Sci-Fi, Shounen",OVA,8,7.36,17268
2068,12293,Campione!: Matsurowanu Kamigami to Kamigoroshi no Maou,"Comedy, Ecchi, Fantasy, Harem, Magic, Romance",TV,13,7.36,151928
2069,3087,Cencoroll,"Action, Sci-Fi",Movie,1,7.36,56370
2070,2383,Cybersix,"Action, Adventure, Romance, Sci-Fi",TV,13,7.36,3607
2071,1678,Cyborg 009: The Cyborg Soldier,"Action, Adventure, Mecha, Sci-Fi, Shounen",TV,52,7.36,14867
2072,17917,Danball Senki Wars,"Action, Kids, Mecha",TV,37,7.36,1880
2073,902,Dragon Ball Z Movie 09: Ginga Girigiri!! Bucchigiri no Sugoi Yatsu,"Adventure, Comedy, Fantasy, Sci-Fi, Shounen",Movie,1,7.36,51083
2074,23539,Gudetama,"Comedy, Kids",TV,Unknown,7.36,2348
2075,16700,Higurashi no Naku Koro ni Kaku: Outbreak,"Horror, Mystery, Psychological, Thriller",OVA,1,7.36,33381
2076,14765,Ixion Saga DT,"Action, Comedy, Fantasy",TV,25,7.36,52569
2077,16035,Karneval (TV),"Action, Fantasy, Mystery, Sci-Fi, Shoujo",TV,13,7.36,108174
2078,31780,Kimi no Kokoro wa Kagayaiteru kai?,Music,Music,1,7.35,2762
2079,15379,Kotoura-san,"Comedy, Drama, Romance, School",TV,12,7.36,123691
2080,32871,Kuroko no Basket Movie 3: Winter Cup Soushuuhen - Tobira no Mukou,"Comedy, Shounen, Sports",Movie,1,7.38,5492
2081,3577,Kyouran Kazoku Nikki,"Comedy, Sci-Fi",TV,26,7.36,20883
2082,1013,Le Chevalier D&#039;Eon,"Historical, Magic, Mystery, Seinen, Supernatural",TV,24,7.36,33035
2083,190,Love Hina Again,"Comedy, Drama, Ecchi, Romance, Shounen",OVA,3,7.36,61154
2084,963,"Love Hina: Motoko no Sentaku, Koi ka Ken... &quot;Naku na&quot;","Drama, Romance, Slice of Life",Special,1,7.36,28222
2085,1609,Mai-Otome Zwei,"Action, Magic",OVA,4,7.36,14615
2086,4056,Masuda Kousuke Gekijou Gag Manga Biyori 3,Comedy,TV,12,7.36,1615
2087,8424,MM!,"Comedy, Ecchi, Harem, School",TV,12,7.36,129672
2088,94,Mobile Suit Gundam Seed Destiny,"Action, Drama, Mecha, Military, Romance, Sci-Fi, Space",TV,50,7.36,65896
2089,13585,Natsuyuki Rendezvous,"Drama, Josei, Romance, Supernatural",TV,11,7.36,40958
2090,16143,One Piece: Kinkyuu Kikaku One Piece Kanzen Kouryakuhou,"Adventure, Comedy, Fantasy, Shounen",Special,1,7.36,5914
2091,31918,Owari no Seraph: Nagoya Kessen-hen - Owaranai Seraph - Nagoya Kessen-hen,"Comedy, Parody, Shounen",Special,4,7.36,11400
2092,9893,Suite Precure♪,"Action, Fantasy, Magic, Shoujo",TV,48,7.36,7314
2093,16868,Sukitte Ii na yo.: Dareka ga,"Romance, School, Shoujo",OVA,1,7.36,27802
2094,6758,Tatakau Shisho: The Book of Bantorra,"Action, Fantasy, Seinen, Super Power",TV,27,7.36,35520
2095,415,Tonari no Yamada-kun,"Comedy, Slice of Life",Movie,1,7.36,16442
2096,7,Witch Hunter Robin,"Action, Drama, Magic, Mystery, Police, Supernatural",TV,26,7.36,64905
2097,976,Yokohama Kaidashi Kikou: Quiet Country Cafe,"Sci-Fi, Seinen, Slice of Life",OVA,2,7.36,7609
2098,7745,Zettai Karen Children OVA: Aitazousei! Ubawareta Mirai?,"Action, Comedy, Shounen, Supernatural",OVA,1,7.36,4277
2099,30870,Ajin Part 3: Shougeki,"Action, Horror, Mystery, Seinen, Supernatural",Movie,1,7.36,9638
2100,17901,All Alone With You,"Fantasy, Music",Music,1,7.35,7612
2101,9925,Amagami SS: Tachibana Miya-hen - Imouto,School,Special,1,7.35,31019
2102,30206,Amagi Brilliant Park: Nonbirishiteiru Hima ga Nai!,Comedy,Special,1,7.35,30342
2103,2116,Captain Tsubasa,"Action, Shounen, Sports",TV,128,7.35,36623
2104,1723,Clannad Movie,"Drama, Fantasy, Romance, School",Movie,1,7.35,99506
2105,61,D.N.Angel,"Action, Comedy, Fantasy, Magic, Romance, School, Shoujo",TV,26,7.35,126914
2106,31163,Dimension W,"Action, Sci-Fi, Seinen",TV,12,7.36,130028
2107,3230,Druaga no Tou: The Aegis of Uruk,"Adventure, Comedy, Fantasy",TV,12,7.35,69683
2108,2484,Gear Fighter Dendoh,"Action, Adventure, Mecha, School, Sci-Fi, Space",TV,38,7.35,1548
2109,19951,Hunter x Hunter Movie: The Last Mission,"Action, Adventure, Shounen, Super Power",Movie,1,7.35,37633
2110,3418,Jungle no Ouja Taa-chan,"Action, Comedy, Parody",TV,50,7.35,801
2111,2544,Kazoku Robinson Hyouryuuki: Fushigi na Shima no Flone,"Adventure, Drama, Historical, Slice of Life",TV,50,7.35,1794
2112,3229,Kimi ga Aruji de Shitsuji ga Ore de,"Comedy, Ecchi, Harem, Parody, Romance",TV,13,7.35,66236
2113,3245,Kindaichi Shounen no Jikenbo Specials,"Mystery, Shounen",Special,2,7.35,1194
2114,3272,Kinnikuman,"Adventure, Comedy, Shounen, Sports",TV,137,7.35,3623
2115,1516,Kirarin☆Revolution,"Comedy, Drama, Romance, Shoujo",TV,153,7.35,14932
2116,32245,Kuromukuro,"Action, Mecha, Sci-Fi",TV,26,7.35,46323
2117,11777,Lupin III: Chi no Kokuin - Eien no Mermaid,"Action, Adventure, Comedy, Shounen",Special,1,7.35,3069
2118,1967,Mobile Suit Zeta Gundam: A New Translation - Heir to the Stars,"Drama, Mecha, Military, Sci-Fi, Space",Movie,1,7.35,6326
2119,3467,Nogizaka Haruka no Himitsu,"Comedy, Romance",TV,12,7.35,80820
2120,16468,One Piece: Glorious Island,"Action, Adventure, Comedy, Fantasy, Shounen, Super Power",Special,2,7.35,12922
2121,2385,One Piece: Jango no Dance Carnival,"Comedy, Fantasy, Shounen",Movie,1,7.35,22157
2122,195,Onegai☆Teacher,"Comedy, Drama, Romance, School, Sci-Fi",TV,12,7.35,99558
2123,3887,Ookiku Furikabutte Special,"Drama, Sports",Special,1,7.35,8478
2124,30714,Owari no Seraph: Owaranai Seraph,"Comedy, Police, Shounen, Supernatural, Vampire",Special,9,7.35,22823
2125,13073,Prince of Tennis: Another Story II - Ano Toki no Bokura OVA Bonus,"Shounen, Sports",Special,2,7.35,2978
2126,21073,Puchimas!!: Petit Petit iDOLM@STER,"Comedy, Slice of Life",ONA,74,7.35,5359
2127,25647,Sabagebu! Specials,"Action, Comedy, Military, Shoujo",Special,6,7.35,9065
2128,13055,Sankarea OVA,"Comedy, Ecchi, Horror, Romance, Shounen, Supernatural",OVA,2,7.35,51997
2129,24029,Shijou Saikyou no Deshi Kenichi Specials,"Action, Comedy, Martial Arts, School, Shounen",Special,4,7.35,4258
2130,28621,Subete ga F ni Naru: The Perfect Insider,"Mystery, Psychological, Sci-Fi",TV,11,7.35,81230
2131,9241,Super Robot Taisen OG: The Inspector,"Action, Mecha, Sci-Fi, Space",TV,26,7.35,5962
2132,390,Suzuka,"Drama, Romance, Sports",TV,26,7.35,64161
2133,21881,Sword Art Online II,"Action, Adventure, Fantasy, Game, Romance",TV,24,7.35,537892
2134,16417,Tamako Market,"Comedy, Slice of Life",TV,12,7.35,128529
2135,2500,The Cockpit,"Historical, Military",OVA,3,7.35,5053
2136,30901,Utawarerumono: Itsuwari no Kamen,"Action, Drama, Fantasy",TV,25,7.35,55851
2137,13677,Ao no Exorcist Movie Special,"Comedy, Parody",Special,1,7.34,20543
2138,9120,Beelzebub: Hirotta Akachan wa Daimaou!?,"Action, Comedy, Demons, School, Shounen, Supernatural",Special,1,7.34,21212
2139,8915,Dantalian no Shoka,"Action, Historical, Mystery, Supernatural",TV,12,7.34,84779
2140,2803,Densetsu no Yuusha Da Garn,"Mecha, Sci-Fi, Shounen",TV,46,7.34,1897
2141,6988,Doraemon Movie 30: Nobita no Ningyo Daikaisen,"Adventure, Comedy, Fantasy, Kids, Shounen",Movie,1,7.34,1191
2142,11053,Doraemon Movie 32: Nobita to Kiseki no Shima - Animal Adventure,"Adventure, Comedy, Fantasy, Kids, Shounen",Movie,1,7.34,849
2143,376,Elfen Lied Special,"Drama, Ecchi, Horror, Psychological, Supernatural",Special,1,7.34,116129
2144,1126,Figure 17: Tsubasa &amp; Hikaru,"Sci-Fi, Slice of Life",TV,13,7.34,6860
2145,1524,Fuujin Monogatari,"Drama, Fantasy, School, Slice of Life, Supernatural",TV,13,7.34,8717
2146,21635,GJ-bu@,"Comedy, School, Slice of Life",Special,1,7.34,18894
2147,5658,Great Mazinger,"Action, Mecha, Sci-Fi, Shounen",TV,56,7.34,1917
2148,27945,Gugure! Kokkuri-san Specials,"Comedy, Romance, Shounen, Supernatural",Special,11,7.34,5870
2149,958,HeatGuy J,"Action, Adventure, Mecha, Police, Sci-Fi",TV,25,7.34,10727
2150,4550,Hyakko,"Comedy, School, Slice of Life",TV,13,7.34,33112
2151,25159,Inou-Battle wa Nichijou-kei no Naka de,"Comedy, Romance, School, Slice of Life, Supernatural",TV,12,7.34,144370
2152,3223,Kiddy Grade: Truth Dawn,"Action, Mecha, Sci-Fi, Super Power",Movie,1,7.34,3174
2153,634,Koi Kaze,"Drama, Psychological, Romance, Seinen",TV,13,7.34,41250
2154,33074,Lupin III (2015) Specials,"Action, Adventure, Comedy, Shounen",Special,2,7.34,1353
2155,1437,Lupin III: Honoo no Kioku - Tokyo Crisis,"Action, Adventure, Comedy, Mystery, Shounen",Special,1,7.34,3138
2156,28013,Macross Δ,"Action, Mecha, Military, Music, Romance, Sci-Fi, Space",TV,26,7.34,30308
2157,18391,Mini Van,"Comedy, Game, Parody, Slice of Life",TV,37,7.34,836
2158,2736,Mojakou,"Comedy, Fantasy, Sci-Fi",TV,74,7.34,1218
2159,11033,"Natsu-iro Egao de 1, 2, Jump!",Music,Music,1,7.34,6939
2160,19653,Neppuu Kairiku Bushi Road,"Action, Fantasy, Mecha, Sci-Fi",Special,1,7.34,19967
2161,9999,One Piece 3D: Mugiwara Chase,"Action, Adventure, Comedy, Fantasy, Shounen",Movie,1,7.34,23772
2162,8171,One Piece Recap,"Action, Adventure, Comedy, Fantasy, Shounen, Super Power",OVA,1,7.34,10147
2163,2386,One Piece: Yume no Soccer Ou!,"Comedy, Fantasy, Shounen, Sports",Movie,1,7.34,23915
2164,107,Ou Dorobou Jing,"Adventure, Comedy, Fantasy, Sci-Fi, Shounen",TV,13,7.34,21920
2165,2847,Pokemon Diamond &amp; Pearl: Dialga vs. Palkia vs. Darkrai,"Action, Adventure, Comedy, Drama, Fantasy, Kids",Movie,1,7.34,38238
2166,2361,Sei Juushi Bismarck,"Action, Mecha, Sci-Fi, Space",TV,51,7.34,2764
2167,28495,Sidonia no Kishi Movie,"Action, Mecha, Sci-Fi, Seinen, Space",Movie,1,7.34,5472
2168,173,Tactics,"Comedy, Drama, Fantasy, Mystery, Shounen, Super Power",TV,25,7.34,27358
2169,1303,The Animatrix,"Action, Drama, Sci-Fi",OVA,9,7.34,42831
2170,3455,To LOVE-Ru,"Comedy, Ecchi, Harem, Romance, School, Sci-Fi",TV,26,7.34,237563
2171,4896,Umineko no Naku Koro ni,"Horror, Mystery, Psychological, Supernatural",TV,26,7.34,126865
2172,883,Yuu☆Yuu☆Hakusho: Meikai Shitou-hen - Honoo no Kizuna,"Action, Comedy",Movie,1,7.34,13775
2173,1901,11-nin Iru!,"Action, Adventure, Drama, Mystery, Romance, Sci-Fi, Shoujo, Space",Movie,1,7.33,4311
2174,32323,Aishen Qiaokeli-ing...,"Comedy, Harem, Romance, School",ONA,15,7.33,11936
2175,12669,Amagami SS+ Plus Specials,Romance,Special,6,7.33,17764
2176,31754,Aoharu x Kikanjuu: Kemono-tachi no Senjou da na!,"Action, Comedy, Shounen",Special,1,7.33,13993
2177,1205,Aru Tabibito no Nikki,"Adventure, Fantasy",ONA,6,7.33,15565
2178,10681,Blood-C: The Last Dark,"Action, Horror, Supernatural, Vampire",Movie,1,7.33,37925
2179,24469,Buddy Complex: Kanketsu-hen - Ano Sora ni Kaeru Mirai de,"Action, Mecha, Sci-Fi",Special,2,7.33,14158
2180,24429,Daze,Music,Music,1,7.33,2919
2181,9379,Denpa Onna to Seishun Otoko,"Comedy, Sci-Fi, Seinen, Slice of Life",TV,12,7.33,149497
2182,2667,Doraemon Movie 04: Nobita no Kaitei Kiganjou,Fantasy,Movie,1,7.33,1168
2183,2666,Doraemon Movie 10: Nobita no Nippon Tanjou,"Adventure, Comedy, Fantasy, Kids, Shounen",Movie,1,7.33,1176
2184,2655,Doraemon Movie 23: Nobita to Robot Kingdom,"Adventure, Comedy, Fantasy, Kids, Shounen",Movie,1,7.33,2139
2185,893,Dragon Ball Movie 4: Saikyou e no Michi,"Action, Adventure, Comedy, Fantasy, Sci-Fi, Shounen, Super Power",Movie,1,7.33,26104
2186,1299,Flag,"Mecha, Military",ONA,13,7.33,10531
2187,29325,Ghost in the Shell: Arise - Alternative Architecture,"Mecha, Police, Psychological, Sci-Fi",TV,10,7.33,21805
2188,24231,Hitsugi no Chaika: Avenging Battle,"Action, Adventure, Comedy, Fantasy, Romance, Shounen",TV,10,7.33,91049
2189,15785,Inazuma Eleven Go vs. Danball Senki W Movie,"Action, Kids, Mecha, Sports",Movie,1,7.34,3239
2190,469,Karin,"Comedy, Romance, School, Shounen, Vampire",TV,24,7.33,106142
2191,3222,Kiddy Grade: Maelstrom,"Action, Mecha, Sci-Fi, Super Power",Movie,1,7.33,3189
2192,11313,Kimi no Iru Machi: Tasogare Kousaten,"Drama, Romance, School, Shounen",OVA,2,7.33,25799
2193,5042,Kiss x Sis,"Comedy, Ecchi, Harem, Romance, School, Seinen",OVA,12,7.33,125614
2194,837,Kyou no 5 no 2,"Comedy, Ecchi, School, Seinen",OVA,4,7.33,22431
2195,1422,Lupin III: $1 Money Wars,"Action, Adventure, Comedy, Shounen",Special,1,7.33,2950
2196,5084,Mai Mai Shinko to Sennen no Mahou,"Adventure, Drama",Movie,1,7.33,6491
2197,7261,Mameshiba,Comedy,Special,24,7.33,3085
2198,5351,Mobile Suit Gundam 00: Tenshitachi no Kiseki,"Action, Mecha, Sci-Fi",Special,1,7.33,4680
2199,2948,Motto! Ojamajo Doremi: Kaeru Ishi no Himitsu,"Kids, Magic, Shoujo",Movie,1,7.33,2108
2200,4879,Mouryou no Hako,"Mystery, Seinen, Supernatural, Thriller",TV,13,7.33,36075
